<?xml version="1.0" encoding="UTF-8" ?>

<model xmlns:xsi="http://www.w3.org/2001/XMLSchema-instance" xsi:noNamespaceSchemaLocation="../schema.xsd">

        <model_name>model_name</model_name>
        <model_version>1.0</model_version>
        <classification>
            <species>species</species>
            <order>primates</order>
            <coverage>
                <cortical>true</cortical>
                <subcortical>false</subcortical>
                <cerebellar>false</cerebellar>
                <brainstem>false</brainstem>
                <spinal>false</spinal>
                <peripheral>false</peripheral>
            </coverage>
            <plausibility>
                <macro>true</macro>
                <meso>true</meso>
                <micro>false</micro>
            </plausibility>
        </classification>
        <interface>
            <inputs>
                <sensory></sensory>
                <auxiliary></auxiliary>
            </inputs>
            <outputs></outputs>
        </interface>

</model>